{
  "schema_version": "1.0",
  "title": "Open Data Portals Directory",
  "source_document": "docs/portals/OPEN_DATA_PORTALE.md",
  "compiled_at": "2026-10-22",
  "method": "Extracted from the curated Markdown list; URL availability, dataset licenses and API availability are not independently verified.",
  "fields_note": "license=unverified is not an assertion that reuse is allowed; last_checked=null means unverified.",
  "count": 100,
  "portals": [
    {
      "id": "source-001",
      "name": "GovData",
      "url": "https://data.gov.de/",
      "category": "1. Zentrale Einstiegsportale und weltweite Portalverzeichnisse",
      "context": "Deutschland | Übergreifender Datenkatalog für Bund, Länder und Kommunen",
      "license": "unverified",
      "api": "unknown",
      "access": "not_verified",
      "last_checked": null
    },
    {
      "id": "source-002",
      "name": "data.europa.eu",
      "url": "https://data.europa.eu/",
      "category": "1. Zentrale Einstiegsportale und weltweite Portalverzeichnisse",
      "context": "EU/Europa | Europäische Datenkataloge und EU-Institutionen",
      "license": "unverified",
      "api": "unknown",
      "access": "not_verified",
      "last_checked": null
    },
    {
      "id": "source-003",
      "name": "Dateno Registry",
      "url": "https://dateno.io/registry/browse/",
      "category": "1. Zentrale Einstiegsportale und weltweite Portalverzeichnisse",
      "context": "Weltweit | Verzeichnis zahlreicher Datenkataloge",
      "license": "unverified",
      "api": "unknown",
      "access": "not_verified",
      "last_checked": null
    },
    {
      "id": "source-004",
      "name": "DataPortals.org",
      "url": "https://www.dataportals.org/",
      "category": "1. Zentrale Einstiegsportale und weltweite Portalverzeichnisse",
      "context": "Weltweit | Internationales Verzeichnis von Open-Data-Portalen",
      "license": "unverified",
      "api": "unknown",
      "access": "not_verified",
      "last_checked": null
    },
    {
      "id": "source-005",
      "name": "Data.gov",
      "url": "https://data.gov/",
      "category": "1. Zentrale Einstiegsportale und weltweite Portalverzeichnisse",
      "context": "USA | Amerikanischer Datenkatalog",
      "license": "unverified",
      "api": "unknown",
      "access": "not_verified",
      "last_checked": null
    },
    {
      "id": "source-006",
      "name": "Google Dataset Search",
      "url": "https://datasetsearch.research.google.com/",
      "category": "1. Zentrale Einstiegsportale und weltweite Portalverzeichnisse",
      "context": "Weltweit | Suchmaschine für Datensätze",
      "license": "unverified",
      "api": "unknown",
      "access": "not_verified",
      "last_checked": null
    },
    {
      "id": "source-007",
      "name": "Atlas Data Portals",
      "url": "https://atlas.co/data-portals/",
      "category": "1. Zentrale Einstiegsportale und weltweite Portalverzeichnisse",
      "context": "Weltweit | Übersicht geografischer und staatlicher Datenportale",
      "license": "unverified",
      "api": "unknown",
      "access": "not_verified",
      "last_checked": null
    },
    {
      "id": "source-008",
      "name": "Baden-Württemberg",
      "url": "https://www.daten-bw.de/",
      "category": "2. Deutschland: Bundesländer",
      "context": "daten.bw",
      "license": "unverified",
      "api": "unknown",
      "access": "not_verified",
      "last_checked": null
    },
    {
      "id": "source-009",
      "name": "Bayern",
      "url": "https://open.bydata.de/",
      "category": "2. Deutschland: Bundesländer",
      "context": "open.bydata",
      "license": "unverified",
      "api": "unknown",
      "access": "not_verified",
      "last_checked": null
    },
    {
      "id": "source-010",
      "name": "Berlin",
      "url": "https://daten.berlin.de/",
      "category": "2. Deutschland: Bundesländer",
      "context": "Datenportal Berlin",
      "license": "unverified",
      "api": "unknown",
      "access": "not_verified",
      "last_checked": null
    },
    {
      "id": "source-011",
      "name": "Brandenburg",
      "url": "https://datenadler.de/",
      "category": "2. Deutschland: Bundesländer",
      "context": "Datenadler",
      "license": "unverified",
      "api": "unknown",
      "access": "not_verified",
      "last_checked": null
    },
    {
      "id": "source-012",
      "name": "Bremen",
      "url": "https://www.transparenz.bremen.de/",
      "category": "2. Deutschland: Bundesländer",
      "context": "Transparenzportal Bremen",
      "license": "unverified",
      "api": "unknown",
      "access": "not_verified",
      "last_checked": null
    },
    {
      "id": "source-013",
      "name": "Hamburg",
      "url": "https://transparenz.hamburg.de/",
      "category": "2. Deutschland: Bundesländer",
      "context": "Transparenzportal Hamburg",
      "license": "unverified",
      "api": "unknown",
      "access": "not_verified",
      "last_checked": null
    },
    {
      "id": "source-014",
      "name": "Hessen",
      "url": "https://opendata.hessen.de/",
      "category": "2. Deutschland: Bundesländer",
      "context": "Open Data Hessen",
      "license": "unverified",
      "api": "unknown",
      "access": "not_verified",
      "last_checked": null
    },
    {
      "id": "source-015",
      "name": "Mecklenburg-Vorpommern",
      "url": "https://www.geoportal-mv.de/",
      "category": "2. Deutschland: Bundesländer",
      "context": "Geoportal MV",
      "license": "unverified",
      "api": "unknown",
      "access": "not_verified",
      "last_checked": null
    },
    {
      "id": "source-016",
      "name": "Niedersachsen",
      "url": "https://www.geodaten.niedersachsen.de/",
      "category": "2. Deutschland: Bundesländer",
      "context": "Geodaten Niedersachsen",
      "license": "unverified",
      "api": "unknown",
      "access": "not_verified",
      "last_checked": null
    },
    {
      "id": "source-017",
      "name": "Nordrhein-Westfalen",
      "url": "https://open.nrw/",
      "category": "2. Deutschland: Bundesländer",
      "context": "Open.NRW",
      "license": "unverified",
      "api": "unknown",
      "access": "not_verified",
      "last_checked": null
    },
    {
      "id": "source-018",
      "name": "Rheinland-Pfalz",
      "url": "https://daten.rlp.de/",
      "category": "2. Deutschland: Bundesländer",
      "context": "Datenportal Rheinland-Pfalz",
      "license": "unverified",
      "api": "unknown",
      "access": "not_verified",
      "last_checked": null
    },
    {
      "id": "source-019",
      "name": "Saarland",
      "url": "https://www.saarland.de/",
      "category": "2. Deutschland: Bundesländer",
      "context": "Landesportal / Einstieg",
      "license": "unverified",
      "api": "unknown",
      "access": "not_verified",
      "last_checked": null
    },
    {
      "id": "source-020",
      "name": "Sachsen",
      "url": "https://www.opendata.sachsen.de/",
      "category": "2. Deutschland: Bundesländer",
      "context": "Open Data Sachsen",
      "license": "unverified",
      "api": "unknown",
      "access": "not_verified",
      "last_checked": null
    },
    {
      "id": "source-021",
      "name": "Sachsen-Anhalt",
      "url": "https://metaver.de/",
      "category": "2. Deutschland: Bundesländer",
      "context": "METAVER (Metadaten- und Geoinformationen)",
      "license": "unverified",
      "api": "unknown",
      "access": "not_verified",
      "last_checked": null
    },
    {
      "id": "source-022",
      "name": "Schleswig-Holstein",
      "url": "https://opendata.schleswig-holstein.de/",
      "category": "2. Deutschland: Bundesländer",
      "context": "Open Data Schleswig-Holstein",
      "license": "unverified",
      "api": "unknown",
      "access": "not_verified",
      "last_checked": null
    },
    {
      "id": "source-023",
      "name": "Thüringen",
      "url": "https://www.geoportal-th.de/",
      "category": "2. Deutschland: Bundesländer",
      "context": "Geoportal Thüringen",
      "license": "unverified",
      "api": "unknown",
      "access": "not_verified",
      "last_checked": null
    },
    {
      "id": "source-024",
      "name": "Leipzig",
      "url": "https://opendata.leipzig.de/de/",
      "category": "3. Deutschland: Städte und Kommunen",
      "context": "Sachsen",
      "license": "unverified",
      "api": "unknown",
      "access": "not_verified",
      "last_checked": null
    },
    {
      "id": "source-025",
      "name": "Dresden",
      "url": "https://opendata.dresden.de/",
      "category": "3. Deutschland: Städte und Kommunen",
      "context": "Sachsen",
      "license": "unverified",
      "api": "unknown",
      "access": "not_verified",
      "last_checked": null
    },
    {
      "id": "source-026",
      "name": "Chemnitz",
      "url": "https://portal-chemnitz.opendata.arcgis.com/",
      "category": "3. Deutschland: Städte und Kommunen",
      "context": "Sachsen",
      "license": "unverified",
      "api": "unknown",
      "access": "not_verified",
      "last_checked": null
    },
    {
      "id": "source-027",
      "name": "Jena",
      "url": "https://opendata.jena.de/",
      "category": "3. Deutschland: Städte und Kommunen",
      "context": "Thüringen",
      "license": "unverified",
      "api": "unknown",
      "access": "not_verified",
      "last_checked": null
    },
    {
      "id": "source-028",
      "name": "München",
      "url": "https://opendata.muenchen.de/",
      "category": "3. Deutschland: Städte und Kommunen",
      "context": "Bayern",
      "license": "unverified",
      "api": "unknown",
      "access": "not_verified",
      "last_checked": null
    },
    {
      "id": "source-029",
      "name": "Stuttgart",
      "url": "https://opendata.stuttgart.de/",
      "category": "3. Deutschland: Städte und Kommunen",
      "context": "Baden-Württemberg",